,id,ticker,title,url,article,date
23,30,AAPL,Foxconn Moves Manufacturing Out Of China,https://www.benzinga.com/node/13056495,"Apple Inc's AAPL manufacturing partner Foxconn Technology Group, which assembles Apple's iPhone product in China, announced on Saturday that it has raised over $213 million for what it described as a ""mega-development"" in India. According to Bloomberg, the investment signals that Foxconn is moving the manufacturing of Apple products out of China.Henry Byers, director of pricing and partnerships at Steam Logistics, said that the current trade dispute between the U.S. and China accelerated the process of some manufacturers moving their supply chains from China to lower-wage countries like India. This will enable manufacturers to report those countries as the ""country of origin"" of their products and potentially avoid U.S. import tariffs on Chinese goods implemented by the Trump Administration.""The bigger you are in terms of market-share volume, the more exposed you are to have your manufacturing and assembly all in one country."" said Byers.Byers said that Foxconn and other manufacturers have considered redirecting their supply chains to support manufacturing operations in countries including India and Vietnam for years. Wages have grown in China due to the country's overall economic growth, causing labor-intensive manufacturing like the assembly of the iPhone to become more expensive. Byers said global economic history shows that the manufacturing sector will leave high-wage countries and move to low-wage countries.""The first thing they've [manufacturers] done is really look at the assembly plants, and then export raw materials and component goods out of China to Vietnam and have them assembled there,"" said Byers. Don't miss it. Register today.India, Vietnam and other lower-wage economies have received more attention from global manufacturing supply chains as they've opened their markets to foreign trade and investment.According to a September 2018 report by McKinsey & Company, Vietnam's manufacturing sector grew from 16 percent of its gross domestic product (GDP) in 2009 to 21 percent of its GDP in 2016. Foxconn, along with Intel, Samsung and Wintek have invested $15 billion in production facilities and partnerships with Vietnamese manufacturers. McKinsey also found that Vietnamese exports increased 14 percent per year between 1996 and 2016 while the market capitalization of listed companies grew 9 percent per year during the same time period.According to the report, Vietnam has been able to attract foreign, private capital through its rapid transition from a socialist economy to a deregulated capitalist economy. The McKinsey report also said that China's focus on becoming a more capital-intensive (less labor through automation) manufacturing market would send labor-intensive manufacturing to countries where labor is cheaper.Manufacturers of labor-intensive goods also want to reduce the exposure associated with China's declining economic growth. China's slowing economy hurt Apple's sales and performance recently.""They [manufacturers] want to diversify more."" said Ibrahiim Bayaan, chief economist at FreightWaves. ""Part of this is tariff-related. The other part has to do with the slowing of the Chinese economy. With growth slowing there, it affects their [manufacturers'] revenues. It's likely that this will affect many electronics companies, and the longer the trade war with the U.S. continues, the more companies will feel pressure to relocate out of China.""In terms of exports, the McKinsey report said that Vietnam's share of the labor-intensive manufacturing market grew by 1.5 percent, from 4.5 percent in 2014 to 6 percent in 2016. This made Vietnam the fastest-growing exporter of labor-intensive manufactured goods and the third-largest exporter of labor-intensive goods after China at 53 percent (down from 56 percent during that period) and India at 9 percent. India had the second-largest share growth in the labor-intensive manufacturing market at 0.7 percent between 2014 and 2016.However, despite these developments and the recent decreases, these figures also show that China is still the largest player by far in the labor-intensive manufacturing market.Want more content like this? Click here to SubscribePermalink",2019-01-29
24,31,AAPL,How To Approach Q4 Earnings: The Technical Perspective,https://www.benzinga.com/node/13057960,"Earnings season is in full swing and the market has seemingly been unfazed by what might otherwise be impactful report deliveries. Things like a disappointing bottom line report from Netflix, Inc. NFLX and extremely mixed signals from financials like Wells Fargo WFC and Citigroup, Inc. C have done little to disrupt the overall momentum that has carried the market higher through most of January.Technically, the S&P 500 is in a very interesting spot relative to its long term pattern. In mid-January, the index approached to within a percent of its 2018 entrance price after losing all of last year’s gains over the final months of 2018.January’s gains put the index at a level its gotten very familiar with, a phenomenon that becomes clear in the chart below, taken stock research platform Finscreener.The S&P 500 revisited that level, just under 2670, several times throughout 2018. In those times, volatility skyrocketed, but the index ultimately lurched forward until the next dramatic fall. That trend is seemingly repeating itself, with the volatility index climbing about 10 percent in the week starting in the approach to 2670.Its difficult to predict what hitting this level once again might mean for the broad market, but individual stocks could provide an indication of the patterns forming around this larger trend. With the help of Finscreener’s technical summary tools, we’ll take a look at the technical health of a few S&P stocks set to report in the final week of the month.Below is a list of companies due to report the week of January 27, alongside their technical ratings based on moving averages and overall technical health.The strongest positive technical signals emerging from the chart are the daily and weekly moving averages. Within that trend, there are a couple pairs of companies that share same industry, like Mastercard Inc. MA and Visa Inc. V and Merck & Co., Inc. MRK and Pfizer Inc. PFE, whose technical health puts them in a strong position to react to their counterparts’ results.However, the technical outlook on traditional market leaders like Apple Inc. AAPL and Facebook Inc. FB is decidedly negative across the board. While earnings beat could likely help to shift the near-term chart trend, the overall trajectory of these stocks might still be negative should volatility persist.On the other hand, mega caps Amazon.com, Inc. AMZN and Boeing Co. BA, which are up YTD 10.4 and 13 percent respectively, both have an overall “Buy” rating based on their weekly technicals. Strong numbers from either will likely reverberate through the broad market, although growth prospects for Amazon have diminished in recent quarters, which might be reflected in their Q4 report, and Boeing has already felt a lift from United Technologies Corporation UTX strong report the previous week that could mute even a solid set of results.While the broad market's long term trend might pose some resistance as the last leg of earnings roll out, those numbers might tip the scale as to whether the market can break its historical levels, or if equity is in store for more uncertainty as 2019 unfolds.",2019-01-29
25,32,AAPL,Apple Reports Q1 Results Today: What You Need To Know,https://www.benzinga.com/node/13055546,"Apple Inc. AAPL surprised investors Tuesday with a slight earnings beat that showed off what some think may be the future of the company as it reported record revenues on Services despite an expected drop in sales of its signature iPhone.Q1 HighlightsAnalysts, on average, expected the iPhone maker to report EPS of $4.17 on revenue of about $84 billion.
Apple Q1 EPS $4.18, Sales $84.31B
Sees Q2 Sales $55B-$59B vs $58.99B Est.
Net sales China $13.1 billion vs. $17.9 billion a year ago
Gross Margin 37%-38%
Q1 Operating Cash Flow $26.7B
Net Cash Balance At End Of Q1 $130B
Apple, which had become the first $1-trillion company last summer, had already set expectations lower for a disappointing quarter due to sluggish iPhone sales, lowering its revenue forecast one month ago.""While it was disappointing to miss our revenue guidance, we manage Apple for the long term, and this quarter's results demonstrate that the underlying strength of our business runs deep and wide,"" CEO Tim Cook said in the release.ProductsApple said iPhone revenue dropped 15 percent from the prior year. But all other revenue grew 19 percent, and services revenue reached a record $10.9 billion, up 19
percent from the prior year.Revenue from the company's Mac computers, Wearables, and Home and Accessories also reached all-time highs, growing 9 percent and 33 percent, respectively, Apple said. Revenue from iPad grew 17 percent.The report came without specific numbers on iPhone sales, following Apple’s announcement in November that it will no longer report unit sales for the signature iPhone, or for Macs and iPads.Apple officials have said services — such as App store downloads — are a better indicator of how the company is performing. It's a market the company believes is a big part of its future as the smartphone market becomes saturated.What's NextCook hit on the shift to Apple as a service model that many believe the company wants to focus on.""Our active installed base of devices reached an all-time high of 1.4 billion in the first quarter, growing in each of our geographic segments. That's a great testament to the satisfaction and loyalty of our customers, and it's driving our Services business to new records thanks to our large and fast-growing ecosystem.""The earnings print followed a report over the weekend that Apple's contract iPhone manufacturer, Foxconn Technology Group, will move manufacturing out of China and to a new production facility in India.Click here to see how Apple shares typically move following an earnings print.Related Links:Apple Lowers Revenue Expectations As China's Market SlowsApple Earnings Preview: Investors Brace For Update On Turbulent Quarter Marred By iPhone WeaknessPhoto courtesy of Apple. ",2019-01-29
26,36,AAPL,25 Stocks Moving In Wednesday's Pre-Market Session,https://www.benzinga.com/node/13063783,"Loading...Loading...Gainers
Eyenovia Inc EYEN shares rose 64.3 percent to $4.32 in pre-market trading after the company disclosed that its MIST-1 study met primary endpoint.
Co-Diagnostics Inc CODX rose 33.6 percent to $1.49 in pre-market trading after the company reported the sale of $3 million of preferred shares, convertible to common stock at a fixed price of $1.20 per share.
Mellanox Technologies, Ltd. MLNX rose 13.8 percent to $92.94 in pre-market trading after Reuters reported that Intel offered up to $6 billion for the company.
Turtle Beach Corporation  HEAR rose 10.7 percent to $15.70 in pre-market trading after falling 3.01 percent on Tuesday.
Advanced Micro Devices, Inc. AMD shares rose 10.6 percent to $21.29 in pre-market trading despite reporting a fourth-quarter sales miss. Fourth-quarter earnings came in at 8 cents per share, falling in-line with analyst estimates. Revenues came in at $1.42 billion, missing estimates by $30 million. The company issued first-quarter sales guidance of $1.2 billion.
Grindrod Shipping Holdings Ltd. GRIN rose 7.2 percent to $6.75 in pre-market trading after dropping 7.35 percent on Tuesday.
Boeing Co BA rose 6.7 percent to $389.50 in pre-market trading after the company posted upbeat Q4 results and issued strong FY19 forecast.
Vale S.A. VALE shares rose 6.6 percent to $12.25 in pre-market trading after gaining 2.50 percent on Tuesday.
Hailiang Education Group Inc. HLG rose 5.7 percent to $36.67 in pre-market trading after declining 6.22 percent on Tuesday.
ICICI Bank Limited  IBN rose 5.3 percent to $10.21 in pre-market trading after reporting Q3 earnings.
Apple Inc. AAPL rose 5.2 percent to $162.61 in pre-market trading after the company reported stronger-than-expected results for its first quarter. The company issued weak second-quarter sales guidance.
Nevro Corp.  NVRO shares rose 5.2 percent to $50.00 in pre-market trading after gaining 2.54 percent on Tuesday.
Box, Inc. BOX rose 4.8 percent to $20.70 in pre-market trading after declining 2.76 percent on Tuesday.
Catabasis Pharmaceuticals, Inc. CATB rose 3.8 percent to $6.10 in pre-market trading.
C.H. Robinson Worldwide, Inc. CHRW rose 3.6 percent to $89.75 in pre-market trading following upbeat Q4 earnings.
 Find out what's going on in today's market and bring any questions you have to Benzinga's PreMarket Prep.Check out these big penny stock gainers and losersLosers
AC Immune SA  ACIU shares fell 39.4 percent to $6.50 in pre-market after the company disclosed that its collaboration partner Roche is discontinuing Phase III CREAD 1 and 2 studies of crenezumab in Alzheimer's disease.
Trevena Inc TRVN fell 15.8 percent to $1.07 in pre-market trading after reporting a $10 million registered direct offering of common stock.
Juniper Networks, Inc. JNPR fell 11.6 percent to $24.70 in pre-market trading. Juniper reported upbeat earnings for its fourth quarter, while sales missed views. The company also issued weak Q1 guidance.
8x8, Inc.  EGHT fell 10.5 percent to $17.28 in pre-market trading after reporting a third-quarter sales miss. Earnings came in at $(0.06) per share.
Align Technology, Inc. ALGN fell 8.5 percent to $203.06 in pre-market trading after the company issued weak Q1 earnings forecast.
Golden Ocean Group Limited  GOGL fell 8.5 percent to $4.98 in pre-market trading.
PG&E Corporation  PCG fell 3.4 percent to $13.51 in pre-market trading after rising 16.49 percent on Tuesday.
AT&T Inc. T fell 3.1 percent to $29.75 in pre-market trading. AT&T reported in-line earnings for its fourth quarter, while sales missed estimates.
Biogen Inc. BIIB fell 3.1 percent to $324.12 in pre-market trading after the company posted Q4 results.
Novartis AG  NVS shares fell 2.2 percent to $84.71 in pre-market trading following downbeat Q4 earnings.


Loading...Loading...",2019-01-30
